{
  "protocol": "MIF-SUITE-FINAL-EVIDENCE/1",
  "status": "ready-for-tag",
  "date": "2026-08-07",
  "suiteDigest": "sha256:81a5feabc281bfc4f830addabc2c6846d1f191bbbcf04e548f04b35dd358ae6f",
  "suiteConformance": true,
  "unexplainedDifferences": 0,
  "suite": {
    "id": "mif-suite-1.0",
    "candidateCommit": "3ee7e57c7d4c7208be91f62914f344a587fb0f70",
    "wireCommit": "7e45d5a3fa970a535ed6a8a8ff5981aba4b9c978",
    "jcsSha256": "sha256:81a5feabc281bfc4f830addabc2c6846d1f191bbbcf04e548f04b35dd358ae6f",
    "rawSha256": "sha256:088ca33234289b06d9276aa4c430758222aa85d61621dee7bef4bfc6dcc069a4"
  },
  "testedDomain": {
    "classification": "exact-for-tested-domain",
    "classes": [
      "identity",
      "key",
      "position",
      "replay",
      "ruleset",
      "transform"
    ],
    "rulesetSemanticDigests": [
      "sha256:173caf8189defd1ab7d4a3e8b9e26688a07fd77976bf09d56bff5fe0c273e1a1",
      "sha256:224f7e368e322a4cc8c1225a025fb548d5b41eb096d34b7ae0543182d1aa9393"
    ],
    "fullConformance": false,
    "conversionClaimed": false
  },
  "adapters": [
    {
      "id": "nmm-llm",
      "adapter": "nmm-llm-python",
      "repository": "https://github.com/benmarkbrandwood-blip/NMM_LLM.git",
      "branch": "dev",
      "implementationCommit": "a7e7dbd5461cc2d8d8c0a09317d6091598202214",
      "evidenceArtifactCommit": "ae7911e37fa2bf45ea6074850453bbad2479438e",
      "evidencePublicationCommit": "b599e0d45a660a020b45860e60c9409b503c454d",
      "evidence": {
        "path": "release/evidence/mif-suite-1.0-nmm-adapter-evidence-2026-08-07.json",
        "rawSha256": "sha256:a482563cfa413141a133b4ade8c53592bc19e5d4a566492b80ef8168f3e2e88d"
      },
      "capability": {
        "path": "release/evidence/mif-suite-1.0-nmm-capability-2026-08-07.json",
        "rawSha256": "sha256:cd661b1156bf7269f976e050446d01797c9959482f1e1843e21ae3ea7f70dcce"
      },
      "deterministicReport": {
        "path": "release/evidence/mif-suite-1.0-nmm-deterministic-report-2026-08-07.json",
        "rawSha256": "sha256:3463f438531fd52847df44fa4186dcba13ed22c7c570a0cc216d9a7eaa797665"
      },
      "differentialReport": {
        "path": "release/evidence/mif-suite-1.0-nmm-differential-report-2026-08-07.json",
        "rawSha256": "sha256:4c86725bfcd1759433374938c8d8eb2a1dacfa6ea3723592eff759162fce8da6"
      }
    },
    {
      "id": "sanmill",
      "adapter": "sanmill-rust",
      "repository": "https://github.com/calcitem/Sanmill.git",
      "branch": "master",
      "implementationCommit": "7e86de7e8156a7d7f46a6a6179a8878051699505",
      "evidenceArtifactCommit": "9d36d04b4d2a8cd5c660e9582426bedeb888b591",
      "evidencePublicationCommit": "57f41c1d0dae90e6f614c6aa9b2c177e9df4ffc0",
      "evidence": {
        "path": "release/evidence/mif-suite-1.0-sanmill-adapter-evidence-2026-08-07.json",
        "rawSha256": "sha256:808ba75d83ff5bc2880ce1c386f255c93a3728e0d33c713ee0fc24720a5546f9"
      },
      "capability": {
        "path": "release/evidence/mif-suite-1.0-sanmill-capability-2026-08-07.json",
        "rawSha256": "sha256:219f444661d9d8362bb4924e0482040ef08555481f7fcea9028aa7738349e2b0"
      },
      "deterministicReport": {
        "path": "release/evidence/mif-suite-1.0-sanmill-deterministic-report-2026-08-07.json",
        "rawSha256": "sha256:cde7b3d9ce3192c3d05f97e2a5fdc3cff5a64717c687e1d69e5be537a8d012e1"
      },
      "differentialReport": {
        "path": "release/evidence/mif-suite-1.0-sanmill-differential-report-2026-08-07.json",
        "rawSha256": "sha256:9085c0e188c84428b9fa65378011d99fab13350800c3baeae5060c88da5d3dd4"
      }
    }
  ],
  "threeAdapter": {
    "configDigest": "sha256:133cc572ba786ebd544e9fe5fc89c67248432952a1a2fce451a3e1ec6bfda0f2",
    "adapters": [
      "mif-reference",
      "nmm-llm-python",
      "sanmill-rust"
    ],
    "deterministic": {
      "path": "release/evidence/mif-suite-1.0-three-adapter-deterministic-report-2026-08-07.json",
      "rawSha256": "sha256:61467c6593fd5b2a528edaa87b346651d5d1076ba3ce35d50afdab1369babebc",
      "passed": 58,
      "failed": 0
    },
    "differential": {
      "path": "release/evidence/mif-suite-1.0-three-adapter-differential-report-2026-08-07.json",
      "rawSha256": "sha256:c571fd8039d7385b5b63b3f3c0f2182794cf150df847002a593a72e76ba151c6",
      "launchDigest": "sha256:560ef369fde248bd96d3468a4336442db1d970ede04f488821509e69925fd48e",
      "runsPassed": 10,
      "runsFailed": 0,
      "mutationFamiliesPassed": 5,
      "mutationFamiliesFailed": 0
    },
    "repetitionsByteIdentical": true
  },
  "verification": {
    "suiteConformance": true,
    "unexplainedDifferences": 0,
    "adapterEvidenceSchemasPassed": 2,
    "capabilitySchemasPassed": 2,
    "reportSchemasPassed": 4,
    "independentMifRerun": true
  }
}
